team,unit_type,position,depth,jersey,player
Louisville Cardinals,Offense,WR-SL,1,5,"Lacy, Caullin RS SR/TR"
Louisville Cardinals,Offense,LT,1,70,"Sylvester, Trevonte RS SR/TR"
Louisville Cardinals,Offense,LG,1,53,"Robinson, Lance GR/TR"
Louisville Cardinals,Offense,C,1,50,"Nygra, Pete RS SR/TR"
Louisville Cardinals,Offense,RG,1,71,"Moussa, Mahamane RS SR/TR"
Louisville Cardinals,Offense,RT,1,60,"Miller, Rasheed RS SR/TR"
Louisville Cardinals,Offense,TE,1,85,"Kurisky, Nate SR"
Louisville Cardinals,Offense,QB,1,7,"Moss, Miller RS SR/TR"
Louisville Cardinals,Offense,RB,1,1,"Brown, Isaac SO"
Louisville Cardinals,Defense,LDE,1,23,"Bailey, Wesley RS SR/TR"
Louisville Cardinals,Defense,NT,1,99,"Guerad, Jordan RS SR/TR"
Louisville Cardinals,Defense,DT,1,90,"Konga, Rene GR/TR"
Louisville Cardinals,Defense,RDE,1,50,"Lubin, Clev RS JR/TR"
Louisville Cardinals,Defense,WLB,1,34,"Quinn, TJ RS SR"
Louisville Cardinals,Defense,MLB,1,12,"Perry, Kalib RS SR/TR"
Louisville Cardinals,Defense,STAR,1,9,"Watts, Antonio SR"
Louisville Cardinals,Defense,LCB,1,4,"Mack, Jabari RS SR/TR"
Louisville Cardinals,Defense,SS,1,21,"Hutchinson, D'Angelo SR"
Louisville Cardinals,Defense,FS,1,27,"Evans Jr., JoJo RS SR/TR"
Louisville Cardinals,Defense,RCB,1,25,"Holloway, Tayon RS JR/TR"
Louisville Cardinals,Special Teams,PT,1,93,"Chapeau, David RS SR/TR"
Louisville Cardinals,Special Teams,PK,1,36,"Ranvier, Cooper RS FR"
Louisville Cardinals,Special Teams,KO,1,98,"Keller, Nick RS JR"
Louisville Cardinals,Special Teams,LS,1,48,"Kochav, Shai RS SR/TR"
Louisville Cardinals,Special Teams,H,1,39,"Schwartz, Carter RS SO"
Louisville Cardinals,Special Teams,PR,1,5,"Lacy, Caullin RS SR/TR"
Louisville Cardinals,Special Teams,KR,1,5,"Lacy, Caullin RS SR/TR"
LSU Tigers,Offense,WR-X,1,0,"Thomas, Zavion SR/TR"
LSU Tigers,Offense,WR-Z,1,6,"Brown, Barion SR/TR"
LSU Tigers,Offense,WR-SL,1,1,"Anderson, Aaron RS JR/TR"
LSU Tigers,Offense,LT,1,71,"Adams, Tyree RS SO"
LSU Tigers,Offense,LG,1,78,"Echols, Coen RS FR"
LSU Tigers,Offense,C,1,61,"Moore, Braelin RS JR/TR"
LSU Tigers,Offense,RG,1,56,"Thompson, Josh RS SR/TR"
LSU Tigers,Offense,RT,1,75,"Davis, Weston RS FR"
LSU Tigers,Offense,TE,1,10,"Sharp, Bauer RS SR/TR"
LSU Tigers,Offense,QB,1,13,"Nussmeier, Garrett RS SR"
LSU Tigers,Offense,RB,1,29,"Durham, Caden SO"
LSU Tigers,Defense,LDE,1,44,"Pyburn, Jack SR/TR"
LSU Tigers,Defense,LDT,1,90,"Guillory II, Jacobian GR"
LSU Tigers,Defense,RDT,1,88,"Gooden, Bernard RS SR/TR"
LSU Tigers,Defense,RDE,1,6,"Payton, Patrick RS SR/TR"
LSU Tigers,Defense,WLB,1,40,"Weeks, Whit JR"
LSU Tigers,Defense,MLB,1,33,"Weeks, West GR/TR"
LSU Tigers,Defense,STAR,1,7,"Perkins Jr., Harold RS JR"
LSU Tigers,Defense,LCB,1,4,"Delane, Mansoor SR/TR"
LSU Tigers,Defense,SS,1,0,"Cooley, Tamarcus RS SO/TR"
LSU Tigers,Defense,FS,1,13,"Haulcy, A.J. SR/TR"
LSU Tigers,Defense,RCB,1,11,"Woodland, PJ SO"
LSU Tigers,Special Teams,PT,1,90,"Chadwick, Grant SO/TR"
LSU Tigers,Special Teams,PK,1,34,"Ramos, Damian RS SR"
LSU Tigers,Special Teams,KO,1,32,"Burrell, Aeron SO"
LSU Tigers,Special Teams,LS,1,51,"Hall, Silas FR"
LSU Tigers,Special Teams,H,1,90,"Chadwick, Grant SO/TR"
LSU Tigers,Special Teams,PR,1,0,"Thomas, Zavion SR/TR"
LSU Tigers,Special Teams,KR,1,6,"Brown, Barion SR/TR"
Marshall Thundering Herd,Offense,WR-X,1,0,"Tamarez, De'Andre RS JR/TR"
Marshall Thundering Herd,Offense,WR-Z,1,13,"Norton, Adrian JR/TR"
Marshall Thundering Herd,Offense,WR-SL,1,4,"Lacey, Demarcus SR/TR"
Marshall Thundering Herd,Offense,LT,1,76,"Montgomery, Tariq RS JR"
Marshall Thundering Herd,Offense,LG,1,60,"Adams, Shunmarkus RS SR/TR"
Marshall Thundering Herd,Offense,C,1,57,"Meeks, Eric RS JR"
Marshall Thundering Herd,Offense,RG,1,70,"Slappy, Jalen RS JR"
Marshall Thundering Herd,Offense,RT,1,79,"Richter, Christian RS JR"
Marshall Thundering Herd,Offense,TE,1,81,"Payne, Toby RS JR"
Marshall Thundering Herd,Offense,QB,1,7,"Del Rio-Wilson, Carlos RS SR/TR"
Marshall Thundering Herd,Offense,RB,1,44,"Roberts, Antwan RS JR/TR"
Marshall Thundering Herd,Defense,DE,1,55,"Hutson III, Paul RS JR/TR"
Marshall Thundering Herd,Defense,NT,1,99,"Whyce Jr., Jamaal RS JR/TR"
Marshall Thundering Herd,Defense,DT,1,5,"Evans, KaTron RS SR/TR"
Marshall Thundering Herd,Defense,WLB,1,9,"Gilmore, Javae RS JR/TR"
Marshall Thundering Herd,Defense,MLB,1,8,"Al-Amin, Jibreel RS JR/TR"
Marshall Thundering Herd,Defense,SLB,1,22,"Martin, Kerion RS SR/TR"
Marshall Thundering Herd,Defense,LCB,1,1,"Trotter, Boogie SR/TR"
Marshall Thundering Herd,Defense,SS,1,0,"Smith, Cam RS SR/TR"
Marshall Thundering Herd,Defense,FS,1,4,"Green-McKnight, Jadarius RS SR/TR"
Marshall Thundering Herd,Defense,RCB,1,3,"Myers, Marvae RS SR/TR"
Marshall Thundering Herd,Defense,NB,1,11,"Pierre-Louis, Josh RS SR/TR"
Marshall Thundering Herd,Special Teams,PT,1,93,"Totten, Nathan RS SO"
Marshall Thundering Herd,Special Teams,PK,1,90,"Quinn, Lorcan FR"
Marshall Thundering Herd,Special Teams,KO,1,90,"Quinn, Lorcan FR"
Marshall Thundering Herd,Special Teams,LS,1,46,"Magorien, Gavin FR"
Marshall Thundering Herd,Special Teams,H,1,93,"Totten, Nathan RS SO"
Marshall Thundering Herd,Special Teams,PR,1,4,"Lacey, Demarcus SR/TR"
Marshall Thundering Herd,Special Teams,KR,1,18,"Turner-Bradshaw, Xayvion RS SO/TR"
Maryland Terrapins,Offense,WR-X,1,5,"Smith Jr., Octavian SR"
Maryland Terrapins,Offense,WR-Z,1,4,"Knotts, Shaleak SR"
Maryland Terrapins,Offense,WR-SL,1,1,"Farooq, Jalil RS SR/TR"
Maryland Terrapins,Offense,LT,1,76,"Perry, Rahtrel RS JR/TR"
Maryland Terrapins,Offense,LG,1,74,"Wright, Isaiah RS SR/TR"
Maryland Terrapins,Offense,C,1,61,"Hershey, Michael SO"
Maryland Terrapins,Offense,RG,1,66,"Bah, Aliou RS JR/TR"
Maryland Terrapins,Offense,RT,1,71,"Herron, Alan SR/TR"
Maryland Terrapins,Offense,TE,1,9,"Fleming, Dorian RS SO/TR"
Maryland Terrapins,Offense,QB,1,7,"Washington, Malik FR"
Maryland Terrapins,Offense,RB,1,0,"Williams, DeJuan RS FR"
Maryland Terrapins,Defense,LDE,1,29,"Stewart, Sidney FR"
Maryland Terrapins,Defense,LDT,1,10,"Rice, Cam GR/TR"
Maryland Terrapins,Defense,RDT,1,46,"Fontus, Dillan JR"
Maryland Terrapins,Defense,RDE,1,9,"Mathis, Zahir FR"
Maryland Terrapins,Defense,WLB,1,1,"Wingate, Daniel JR"
Maryland Terrapins,Defense,MLB,1,3,"Reddick, Trey SO"
Maryland Terrapins,Defense,LCB,1,14,"Glasker, Jamare RS JR/TR"
Maryland Terrapins,Defense,SS,1,13,"Scruggs, Lavain RS JR"
Maryland Terrapins,Defense,FS,1,22,"Huskey, Jalen SR/TR"
Maryland Terrapins,Defense,RCB,1,6,"Joyner, Dontay JR/TR"
Maryland Terrapins,Defense,NB,1,4,"Humes, Kevyn SO"
Maryland Terrapins,Special Teams,PT,1,34,"McFerson, Bryce RS JR/TR"
Maryland Terrapins,Special Teams,PK,1,36,"O'Haire, Sean RS FR/TR"
Maryland Terrapins,Special Teams,KO,1,43,"Noyes, Philip RS FR"
Maryland Terrapins,Special Teams,LS,1,96,"Gough, Ethan RS SR"
Maryland Terrapins,Special Teams,H,1,34,"McFerson, Bryce RS JR/TR"
Maryland Terrapins,Special Teams,PR,1,1,"Farooq, Jalil RS SR/TR"
Maryland Terrapins,Special Teams,KR,1,24,"Howard, Iverson FR"
Memphis Tigers,Offense,WR-X,1,4,"Braham Jr., Cortez RS SR/TR"
Memphis Tigers,Offense,WR-Z,1,6,"Bussey, Marcello RS SR/TR"
Memphis Tigers,Offense,WR-SL,1,9,"Hawkins, Jamari RS JR"
Memphis Tigers,Offense,LT,1,61,"Adams, Chris RS SR/TR"
Memphis Tigers,Offense,LG,1,72,"Breland, Malachi RS SO"
Memphis Tigers,Offense,C,1,52,"Walker, Yakiri RS SR/TR"
Memphis Tigers,Offense,RG,1,70,"Mitchell, Parker RS JR/TR"
Memphis Tigers,Offense,RT,1,78,"Burke, Travis RS SR/TR"
Memphis Tigers,Offense,TE,1,15,"Ross, Christian RS SO"
Memphis Tigers,Offense,QB,1,2,"Lewis, Brendon RS SR/TR"
Memphis Tigers,Offense,RB,1,13,"Desrosiers Jr., Greg RS SR/TR"
Memphis Tigers,Defense,LDE,1,93,"Bell, Jalen GR/TR"
Memphis Tigers,Defense,NT,1,99,"Walker, Pooda RS SR/TR"
Memphis Tigers,Defense,RDE,1,9,"Whitlow Jr., William RS SR"
Memphis Tigers,Defense,WLB,1,6,"Roussaw Jr., Everett JR/TR"
Memphis Tigers,Defense,MLB,1,3,"Brumfield, Sam RS SR/TR"
Memphis Tigers,Defense,SLB,1,7,"Watts, Drue RS SR/TR"
Memphis Tigers,Defense,LCB,1,1,"Cooper, Omarion RS SR/TR"
Memphis Tigers,Defense,SS,1,5,"Bracy, Chris RS SO/TR"
Memphis Tigers,Defense,FS,1,31,"Ward, DeMarco RS SO/TR"
Memphis Tigers,Defense,RCB,1,29,"Denis, Jaidyn RS SR/TR"
Memphis Tigers,Defense,NB,1,24,"Wilson, Kamari RS JR/TR"
Memphis Tigers,Special Teams,PT,1,30,"Carrigan, Lachlan FR"
Memphis Tigers,Special Teams,PK,1,44,"Spetic, Gianni JR/TR"
Memphis Tigers,Special Teams,KO,1,44,"Spetic, Gianni JR/TR"
Memphis Tigers,Special Teams,LS,1,40,"Zarut, Jonathan RS FR"
Memphis Tigers,Special Teams,H,1,30,"Carrigan, Lachlan FR"
Memphis Tigers,Special Teams,PR,1,5,"Smith, Sutton RS JR"
Memphis Tigers,Special Teams,KR,1,13,"Desrosiers Jr., Greg RS SR/TR"
Miami Hurricanes,Offense,WR-X,1,0,"Marion, Keelan RS SR/TR"
Miami Hurricanes,Offense,WR-Z,1,7,"Daniels, CJ RS SR/TR"
Miami Hurricanes,Offense,WR-SL,1,10,"Toney, Malachi FR"
Miami Hurricanes,Offense,LT,1,70,"Bell, Markel SR/TR"
Miami Hurricanes,Offense,LG,1,78,"McCoy, Matthew RS JR"
Miami Hurricanes,Offense,C,1,52,"Brockermeyer, James RS SR/TR"
Miami Hurricanes,Offense,RG,1,73,"Cooper, Anez SR"
Miami Hurricanes,Offense,RT,1,61,"Mauigoa, Francis JR"
Miami Hurricanes,Offense,TE,1,87,"Bauman, Alex SR/TR"
Miami Hurricanes,Offense,QB,1,11,"Beck, Carson RS SR/TR"
Miami Hurricanes,Offense,RB,1,4,"Fletcher Jr., Mark JR"
Miami Hurricanes,Defense,LDE,1,4,"Bain Jr., Rueben JR"
Miami Hurricanes,Defense,NT,1,11,"Blay Jr., David RS SR/TR"
Miami Hurricanes,Defense,DT,1,99,"Moten Sr., Ahmad RS JR"
Miami Hurricanes,Defense,RDE,1,3,"Mesidor, Akheem RS SR/TR"
Miami Hurricanes,Defense,WLB,1,1,"Toure, Mohamed RS SR/TR"
Miami Hurricanes,Defense,MLB,1,31,"Bissainthe, Wesley SR"
Miami Hurricanes,Defense,LCB,1,29,"Frederique Jr., OJ SO"
Miami Hurricanes,Defense,SS,1,8,"Thomas, Jakobe RS SR/TR"
Miami Hurricanes,Defense,FS,1,7,"Poyser, Zechariah RS SO/TR"
Miami Hurricanes,Defense,RCB,1,2,"Brown, Damari RS SO"
Miami Hurricanes,Defense,NB,1,0,"Scott, Keionte SR/TR"
Miami Hurricanes,Special Teams,PT,1,94,"Joyce, Dylan JR"
Miami Hurricanes,Special Teams,PK,1,38,"Davis, Carter SR/TR"
Miami Hurricanes,Special Teams,KO,1,38,"Davis, Carter SR/TR"
Miami Hurricanes,Special Teams,LS,1,46,"Booker, Adam RS JR/TR"
Miami Hurricanes,Special Teams,H,1,94,"Joyce, Dylan JR"
Miami Hurricanes,Special Teams,PR,1,10,"Toney, Malachi FR"
Miami Hurricanes,Special Teams,KR,1,0,"Marion, Keelan RS SR/TR"
Miami (Ohio) RedHawks,Offense,WR-X,1,84,"Weaver, Cole RS SO"
Miami (Ohio) RedHawks,Offense,WR-Z,1,17,"Isom, Braylon RS FR"
Miami (Ohio) RedHawks,Offense,WR-SL,1,8,"Perry, Kam RS JR/TR"
Miami (Ohio) RedHawks,Offense,LT,1,51,"Smith, Eric RS JR"
Miami (Ohio) RedHawks,Offense,LG,1,74,"Smith Jr., Greg RS SO"
Miami (Ohio) RedHawks,Offense,OC,1,72,"Manu, Kris RS FR"
Miami (Ohio) RedHawks,Offense,RG,1,70,"Schorsch, Jacob RS FR"
Miami (Ohio) RedHawks,Offense,RT,1,78,"Terrill, Drew RS JR"
Miami (Ohio) RedHawks,Offense,TE,1,86,"Shane, Brian RS SR"
Miami (Ohio) RedHawks,Offense,QB,1,12,"Hesson, Henry RS SR"
Miami (Ohio) RedHawks,Offense,RB,1,6,"Brunson, Jordan RS SR/TR"
Miami (Ohio) RedHawks,Defense,LDE,1,20,"Trick, Adam RS JR"
Miami (Ohio) RedHawks,Defense,NT,1,92,"Andrews III, Roosevelt RS SO"
Miami (Ohio) RedHawks,Defense,DT,1,52,"Washington, Nasir RS SR"
Miami (Ohio) RedHawks,Defense,RDE,1,94,"Lukusa, Josh RS JR"
Miami (Ohio) RedHawks,Defense,WLB,1,33,"Kuwatch, Jackson RS SR/TR"
Miami (Ohio) RedHawks,Defense,MLB,1,12,"Hondru, Corban RS SR"
Miami (Ohio) RedHawks,Defense,LCB,1,5,"Evans, Luke RS SO/TR"
Miami (Ohio) RedHawks,Defense,SS,1,1,"Blakey, Eli RS SR"
Miami (Ohio) RedHawks,Defense,FS,1,8,"Beasley, Koy RS FR/TR"
Miami (Ohio) RedHawks,Defense,RCB,1,17,"Martin, Kaleb SO"
Miami (Ohio) RedHawks,Defense,NB,1,29,"Walters, Silas RS SR"
Miami (Ohio) RedHawks,Special Teams,PT,1,34,"Stainton, Pierse RS JR/TR"
Miami (Ohio) RedHawks,Special Teams,PK,1,31,"Dzioban, Dom RS SR"
Miami (Ohio) RedHawks,Special Teams,KO,1,36,"Holden, Carter RS FR"
Miami (Ohio) RedHawks,Special Teams,LS,1,59,"Powell, Hudson RS JR"
Miami (Ohio) RedHawks,Special Teams,H,1,34,"Stainton, Pierse RS JR/TR"
Miami (Ohio) RedHawks,Special Teams,PR,1,10,"Billups-Williams, Lynel RS SO"
Miami (Ohio) RedHawks,Special Teams,KR,1,0,"Reynolds, Keith RS SO/TR"
Michigan Wolverines,Offense,WR-X,1,1,"McCulley, Donaven GR/TR"
Michigan Wolverines,Offense,WR-Z,1,9,"Goodwin, Channing RS FR"
Michigan Wolverines,Offense,WR-SL,1,0,"Morgan, Semaj JR"
Michigan Wolverines,Offense,LT,1,71,"Link, Evan RS SO"
Michigan Wolverines,Offense,LG,1,58,"El-Hadi, Giovanni RS SR"
Michigan Wolverines,Offense,C,1,51,"Crippen, Greg RS SR"
Michigan Wolverines,Offense,RG,1,70,"Norton, Brady RS SO/TR"
Michigan Wolverines,Offense,RT,1,54,"Sprague, Andrew RS FR"
Michigan Wolverines,Offense,TE,1,17,"Klein, Marlin RS JR"
Michigan Wolverines,Offense,QB,1,19,"Underwood, Bryce FR"
Michigan Wolverines,Offense,RB,1,22,"Haynes, Justice JR/TR"
Michigan Wolverines,Defense,DE,1,26,"Benny, Rayshaun GR"
Michigan Wolverines,Defense,NT,1,44,"Payne, Damon GR/TR"
Michigan Wolverines,Defense,DT,1,95,"Pierce, Trey JR"
Michigan Wolverines,Defense,LOLB,1,8,"Moore, Derrick SR"
Michigan Wolverines,Defense,WLB,1,30,"Rolder, Jimmy SR"
Michigan Wolverines,Defense,MLB,1,15,"Hausmann, Ernest SR/TR"
Michigan Wolverines,Defense,ROLB,1,4,"Guy, TJ GR"
Michigan Wolverines,Defense,LCB,1,20,"Hill, Jyaire RS SO"
Michigan Wolverines,Defense,SS,1,25,"Curtis, Mason SO"
Michigan Wolverines,Defense,FS,1,6,"Hillman, Brandyn JR"
Michigan Wolverines,Defense,RCB,1,27,"Sanders, Jayden FR"
Michigan Wolverines,Defense,NB,1,7,"Metcalf, TJ JR/TR"
Michigan Wolverines,Special Teams,PT,1,90,"Hollenbeck, Hudson RS JR/TR"
Michigan Wolverines,Special Teams,PK,1,96,"Zvada, Dominic SR/TR"
Michigan Wolverines,Special Teams,KO,1,92,"Sunderland, Beckham RS JR/TR"
Michigan Wolverines,Special Teams,LS,1,45,"Tarr, Greg GR"
Michigan Wolverines,Special Teams,H,1,90,"Hollenbeck, Hudson RS JR/TR"
Michigan Wolverines,Special Teams,PR,1,0,"Morgan, Semaj JR"
Michigan Wolverines,Special Teams,KR,1,4,"Marsh, Andrew FR"
Michigan State Spartans,Offense,WR-X,1,6,"Marsh, Nick SO"
Michigan State Spartans,Offense,WR-Z,1,1,"Kelly, Omari SR/TR"
Michigan State Spartans,Offense,WR-F,1,13,"McCray, Chrishon RS JR/TR"
Michigan State Spartans,Offense,LT,1,73,"Young, Rustin RS FR"
Michigan State Spartans,Offense,LG,1,72,"Carter, Caleb RS SR/TR"
Michigan State Spartans,Offense,C,1,51,"Gulbin, Matt RS SR/TR"
Michigan State Spartans,Offense,RG,1,55,"Johnson, Rakeem RS FR"
Michigan State Spartans,Offense,RT,1,58,"Moore, Conner RS JR/TR"
Michigan State Spartans,Offense,TE,1,81,"Masunas, Michael RS JR"
Michigan State Spartans,Offense,QB,1,11,"Milivojevic, Alessio RS FR"
Michigan State Spartans,Offense,RB,1,5,"Frazier, Makhi SO"
Michigan State Spartans,Defense,LDE,1,9,"Thompson, Jalen JR"
Michigan State Spartans,Defense,LDT,1,91,"VanSumeren, Alex RS JR"
Michigan State Spartans,Defense,RDT,1,16,"Kelly, Grady RS SR/TR"
Michigan State Spartans,Defense,RDE,1,13,"Smith, Isaac RS SR/TR"
Michigan State Spartans,Defense,WLB,1,10,"Matthews III, Wayne RS SR/TR"
Michigan State Spartans,Defense,MLB,1,5,"Hall, Jordan JR"
Michigan State Spartans,Defense,LCB,1,14,"Bell, Malcolm RS SR/TR"
Michigan State Spartans,Defense,SS,1,19,"Smith, Armorion RS SR/TR"
Michigan State Spartans,Defense,FS,1,43,"Spencer, Malik SR"
Michigan State Spartans,Defense,RCB,1,2,"West, Aydan FR"
Michigan State Spartans,Defense,NB,1,28,"Nash, Dontavius RS SR/TR"
Michigan State Spartans,Special Teams,PT,1,96,"Eckley, Ryan RS JR"
Michigan State Spartans,Special Teams,PK,1,29,"Connington, Martin RS FR"
Michigan State Spartans,Special Teams,KO,1,29,"Connington, Martin RS FR"
Michigan State Spartans,Special Teams,LS,1,87,"Wills, Jack FR"
Michigan State Spartans,Special Teams,H,1,96,"Eckley, Ryan RS JR"
Michigan State Spartans,Special Teams,PR,1,1,"Kelly, Omari SR/TR"
Michigan State Spartans,Special Teams,KR,1,0,"Brown, Alante RS SR/TR"
Middle Tennessee Blue Raiders,Offense,WR-X,1,1,"Cox, Nahzae JR/TR"
Middle Tennessee Blue Raiders,Offense,WR-Z,1,6,"Jones, AJ RS JR/TR"
Middle Tennessee Blue Raiders,Offense,WR-SL,1,13,"Lacy, Cam'ron RS SO"
Middle Tennessee Blue Raiders,Offense,LT,1,72,"Otts, Jacob GR/TR"
Middle Tennessee Blue Raiders,Offense,LG,1,61,"Janse Van Rensburg, Otto FR"
Middle Tennessee Blue Raiders,Offense,C,1,55,"Guevara, Mateo RS JR"
Middle Tennessee Blue Raiders,Offense,RG,1,63,"Gale, Alex RS FR"
Middle Tennessee Blue Raiders,Offense,RT,1,71,"Adams, Ellis GR/TR"
Middle Tennessee Blue Raiders,Offense,TE,1,82,"Tipton, Hunter RS JR/TR"
Middle Tennessee Blue Raiders,Offense,QB,1,11,"Vattiato, Nicholas RS SR"
Middle Tennessee Blue Raiders,Offense,RB,1,9,"Middlebrook, Jekail RS SO"
Middle Tennessee Blue Raiders,Defense,DE,1,0,"Bynum, Anthony RS SO"
Middle Tennessee Blue Raiders,Defense,NT,1,98,"Woods, Shakai RS SO"
Middle Tennessee Blue Raiders,Defense,DT,1,92,"Smith, Damonte RS SR"
Middle Tennessee Blue Raiders,Defense,OLB,1,46,"Johnson, Reggie RS JR/TR"
Middle Tennessee Blue Raiders,Defense,WLB,1,9,"Hughes, Parker GR"
Middle Tennessee Blue Raiders,Defense,MLB,1,3,"Mitchell, Alex SR/TR"
Middle Tennessee Blue Raiders,Defense,LCB,1,2,"McDonald, De'Arre GR/TR"
Middle Tennessee Blue Raiders,Defense,SS,1,7,"Harris, Brendon GR/TR"
Middle Tennessee Blue Raiders,Defense,FS,1,39,"Noble, Christofer FR"
Middle Tennessee Blue Raiders,Defense,RCB,1,25,"Lowe, Jackson RS FR"
Middle Tennessee Blue Raiders,Defense,NB,1,21,"Muhammad, Abdul SR/TR"
Middle Tennessee Blue Raiders,Special Teams,PT,1,32,"Logan, Ashton RS JR/TR"
Middle Tennessee Blue Raiders,Special Teams,PK,1,99,"Hathaway, Jacob RS SR/TR"
Middle Tennessee Blue Raiders,Special Teams,KO,1,95,"Woodman, Baylen FR"
Middle Tennessee Blue Raiders,Special Teams,LS,1,41,"Stone, Mykah RS SR/TR"
Middle Tennessee Blue Raiders,Special Teams,H,1,32,"Logan, Ashton RS JR/TR"
Middle Tennessee Blue Raiders,Special Teams,PR,1,9,"Middlebrook, Jekail RS SO"
Middle Tennessee Blue Raiders,Special Teams,KR,1,29,"Taylor, DJ FR"
Minnesota Golden Gophers,Offense,WR-X,1,8,"Smith, Jalen RS FR"
Minnesota Golden Gophers,Offense,WR-Z,1,11,"Tracy, Javon RS JR/TR"
Minnesota Golden Gophers,Offense,WR-SL,1,0,"Brockington, Le'Meke RS SR"
Minnesota Golden Gophers,Offense,LT,1,50,"Roy, Nathan RS FR"
Minnesota Golden Gophers,Offense,LG,1,65,"Johnson, Greg JR"
Minnesota Golden Gophers,Offense,C,1,78,"Beers, Ashton RS JR"
Minnesota Golden Gophers,Offense,RG,1,74,"Marshall, Marcellus RS SR/TR"
Minnesota Golden Gophers,Offense,RT,1,73,"Ray, Dylan RS SR/TR"
Minnesota Golden Gophers,Offense,TE,1,86,"Geers, Jameson RS SR"
Minnesota Golden Gophers,Offense,QB,1,5,"Lindsey, Drake RS FR"
Minnesota Golden Gophers,Offense,RB,1,1,"Taylor, Darius JR"
Minnesota Golden Gophers,Defense,DE,1,0,"Smith, Anthony RS JR"
Minnesota Golden Gophers,Defense,NT,1,91,"Eastern, Deven RS SR"
Minnesota Golden Gophers,Defense,DT,1,97,"Logan-Redding, Jalen RS SR"
Minnesota Golden Gophers,Defense,RUSH,1,1,"Howard, Jaxon RS SO/TR"
Minnesota Golden Gophers,Defense,WLB,1,9,"Williams, Devon RS SR"
Minnesota Golden Gophers,Defense,MLB,1,6,"Baranowski, Maverick RS JR"
Minnesota Golden Gophers,Defense,LCB,1,17,"Nestor, John JR/TR"
Minnesota Golden Gophers,Defense,SS,1,3,"Perich, Koi SO"
Minnesota Golden Gophers,Defense,FS,1,14,"Brown, Kerry RS SO"
Minnesota Golden Gophers,Defense,RCB,1,4,"Bryan, Za'Quan RS SO"
Minnesota Golden Gophers,Defense,NB,1,12,"Green, Darius RS SR"
Minnesota Golden Gophers,Special Teams,PT,1,42,"Weston, Tom RS SO/TR"
Minnesota Golden Gophers,Special Teams,PK,1,92,"Denaburg, Brady SR/TR"
Minnesota Golden Gophers,Special Teams,KO,1,92,"Denaburg, Brady SR/TR"
Minnesota Golden Gophers,Special Teams,LS,1,80,"Soukup, Alan SO"
Minnesota Golden Gophers,Special Teams,H,1,42,"Weston, Tom RS SO/TR"
Minnesota Golden Gophers,Special Teams,PR,1,3,"Perich, Koi SO"
Minnesota Golden Gophers,Special Teams,KR,1,3,"Perich, Koi SO"
Mississippi State Bulldogs,Offense,WR-X,1,0,"Thompson, Brenen SR/TR"
Mississippi State Bulldogs,Offense,WR-Z,1,4,"Mosley, Jordan RS SR/TR"
Mississippi State Bulldogs,Offense,WR-SL,1,3,"Evans III, Anthony JR/TR"
Mississippi State Bulldogs,Offense,LT,1,77,"James, Jayvin Q. RS SO/TR"
Mississippi State Bulldogs,Offense,LG,1,75,"Jackson, Jacoby RS SR/TR"
Mississippi State Bulldogs,Offense,C,1,72,"Boone, Canon RS SR"
Mississippi State Bulldogs,Offense,RG,1,52,"Owens, Zack RS SO/TR"
Mississippi State Bulldogs,Offense,RT,1,76,"Reese IV, Albert RS SR"
Mississippi State Bulldogs,Offense,TE,1,8,"Traore, Seydou RS SR/TR"
Mississippi State Bulldogs,Offense,QB,1,2,"Shapen, Blake GR/TR"
Mississippi State Bulldogs,Offense,RB,1,24,"Bothwell, Fluff SO/TR"
Mississippi State Bulldogs,Defense,DE,1,6,"Anderson, Deonte RS SR"
Mississippi State Bulldogs,Defense,NT,1,92,"Bledsoe, Jaray RS JR/TR"
Mississippi State Bulldogs,Defense,DT,1,22,"Bingley-Jones, Kedrick RS SR/TR"
Mississippi State Bulldogs,Defense,JACK,1,44,"Jennings, Branden RS SR/TR"
Mississippi State Bulldogs,Defense,WLB,1,7,"Tillman, Zakari JR"
Mississippi State Bulldogs,Defense,MLB,1,40,"Mitchell, Nic RS SR"
Mississippi State Bulldogs,Defense,LCB,1,1,"Jones, Kelley RS SO"
Mississippi State Bulldogs,Defense,SS,1,21,"Washington, Hunter RS SR/TR"
Mississippi State Bulldogs,Defense,FS,1,3,"Lanier, Brylan RS SR/TR"
Mississippi State Bulldogs,Defense,RCB,1,4,"Brumfield, DeAgo RS SR/TR"
Mississippi State Bulldogs,Defense,NB,1,2,"Smith, Isaac JR"
Mississippi State Bulldogs,Special Teams,PT,1,88,"Pulliam, Ethan RS SO"
Mississippi State Bulldogs,Special Teams,PK,1,80,"Ferrie, Kyle JR"
Mississippi State Bulldogs,Special Teams,KO,1,49,"Hauck, Marlon RS JR/TR"
Mississippi State Bulldogs,Special Teams,LS,1,45,"Myers, Ethan RS SR/TR"
Mississippi State Bulldogs,Special Teams,H,1,88,"Pulliam, Ethan RS SO"
Mississippi State Bulldogs,Special Teams,PR,1,3,"Evans III, Anthony JR/TR"
Mississippi State Bulldogs,Special Teams,KR,1,6,"Booth, Davon GR/TR"
Missouri Tigers,Offense,WR-X,1,2,"Johnson, Marquis JR"
Missouri Tigers,Offense,WR-Z,1,0,"Manning, Joshua JR"
Missouri Tigers,Offense,WR-H,1,3,"Coleman Jr., Kevin SR/TR"
Missouri Tigers,Offense,LT,1,70,"Green, Cayden JR/TR"
Missouri Tigers,Offense,LG,1,56,"Giudice, Dominick GR/TR"
Missouri Tigers,Offense,C,1,55,"Tollison, Connor GR"
Missouri Tigers,Offense,RG,1,77,"Peagler, Curtis RS JR"
Missouri Tigers,Offense,RT,1,79,"Trost, Keagen GR/TR"
Missouri Tigers,Offense,TE-Y,1,87,"Norfleet, Brett JR"
Missouri Tigers,Offense,QB,1,5,"Zollers, Matt FR"
Missouri Tigers,Offense,RB,1,29,"Hardy, Ahmad SO/TR"
Missouri Tigers,Defense,DE,1,9,"Young, Zion SR/TR"
Missouri Tigers,Defense,NT,1,33,"Gracial, Marquis RS JR"
Missouri Tigers,Defense,DT,1,7,"McClellan, Chris SR/TR"
Missouri Tigers,Defense,JACK,1,8,"Wilson II, Damon JR/TR"
Missouri Tigers,Defense,WLB,1,14,"Newson, Triston GR/TR"
Missouri Tigers,Defense,MLB,1,40,"Trotter, Josiah RS SO/TR"
Missouri Tigers,Defense,LCB,1,2,"Pride Jr., Toriano SR/TR"
Missouri Tigers,Defense,SS,1,6,"Catalon, Jalen GR/TR"
Missouri Tigers,Defense,FS,1,1,"Burks Jr., Marvin JR"
Missouri Tigers,Defense,RCB,1,12,"Norwood, Drey RS SR/TR"
Missouri Tigers,Defense,NB,1,13,"Carnell, Daylan GR"
Missouri Tigers,Special Teams,PT,1,45,"Weselman, Connor GR/TR"
Missouri Tigers,Special Teams,PK,1,88,"Meyer, Robert FR"
Missouri Tigers,Special Teams,KO,1,48,"Robbins, Oliver SO/TR"
Missouri Tigers,Special Teams,LS,1,51,"Le Blanc, Brett JR"
Missouri Tigers,Special Teams,H,1,45,"Weselman, Connor GR/TR"
Missouri Tigers,Special Teams,PR,1,3,"Coleman Jr., Kevin SR/TR"
Missouri Tigers,Special Teams,KR,1,22,"Jones, Tavorus RS JR"
Missouri State Bears,Offense,WR-X,1,11,"Cope, Makai RS SR/TR"
Missouri State Bears,Offense,WR-Z,1,0,"Robinson, Jmariyae RS JR"
Missouri State Bears,Offense,WR-SL,1,1,"Luke, Dash RS SR/TR"
Missouri State Bears,Offense,LT,1,51,"Nnabugwu, Ebubedike RS SO/TR"
Missouri State Bears,Offense,LG,1,72,"Hutchinson, Mark RS SR/TR"
Missouri State Bears,Offense,C,1,71,"Hudson, Cash RS JR"
Missouri State Bears,Offense,RG,1,54,"Greene, Matthew RS SO/TR"
Missouri State Bears,Offense,RT,1,74,"Cade, Erick RS SR/TR"
Missouri State Bears,Offense,TE,1,88,"Askren, Jeron RS FR"
Missouri State Bears,Offense,QB,1,12,"Clark, Jacob RS SR/TR"
Missouri State Bears,Offense,RB,1,2,"Lawrence, Shomari RS SR/TR"
Missouri State Bears,Offense,FB,1,40,"Lair, Connor RS JR"
Missouri State Bears,Defense,LDE,1,7,"Wesolak, DJ RS JR/TR"
Missouri State Bears,Defense,LDT,1,99,"Williams, Ryan RS SR/TR"
Missouri State Bears,Defense,RDT,1,90,"Smithson, Sterling RS SR"
Missouri State Bears,Defense,RDE,1,17,"Townley Jr., Davon RS SR/TR"
Missouri State Bears,Defense,WLB,1,44,"Young, Kanye SR/TR"
Missouri State Bears,Defense,MLB,1,6,"Lloyd, Jared RS JR"
Missouri State Bears,Defense,SLB,1,31,"Roy, Cooper RS SO"
Missouri State Bears,Defense,LCB,1,12,"Dunbar, Jordan RS SR/TR"
Missouri State Bears,Defense,SS,1,29,"Ford, Christian RS SO/TR"
Missouri State Bears,Defense,FS,1,0,"Neal, Maguire SR/TR"
Missouri State Bears,Defense,RCB,1,14,"Anderson, Thomas RS SR/TR"
Missouri State Bears,Defense,NB,1,9,"Dixson, Dylan RS JR/TR"
Missouri State Bears,Special Teams,PT,1,25,"McDonald, Stewart RS FR"
Missouri State Bears,Special Teams,PK,1,36,"Obeid, Yousef RS SO/TR"
Missouri State Bears,Special Teams,KO,1,36,"Obeid, Yousef RS SO/TR"
Missouri State Bears,Special Teams,LS,1,91,"Weisenborn, Mitch FR"
Missouri State Bears,Special Teams,H,1,25,"McDonald, Stewart RS FR"
Missouri State Bears,Special Teams,PR,1,1,"Luke, Dash RS SR/TR"
Missouri State Bears,Special Teams,KR,1,1,"Luke, Dash RS SR/TR"
Navy Midshipmen,Offense,WR-X,1,82,"Kent, Nathan SR"
Navy Midshipmen,Offense,LT,1,73,"Crowley, Sean SO"
Navy Midshipmen,Offense,LG,1,68,"Purvis, Ben SR"
Navy Midshipmen,Offense,C,1,69,"Nichols, Cam JR"
Navy Midshipmen,Offense,RG,1,79,"Smith II, Hoke JR"
Navy Midshipmen,Offense,RT,1,93,"Johnson, Malcolm FR"
Navy Midshipmen,Offense,TE,1,83,"Howard, Cody SR"
Navy Midshipmen,Offense,QB,1,11,"Horvath, Blake SR"
Navy Midshipmen,Offense,SB-A,1,24,"Chatman, Brandon SR"
Navy Midshipmen,Offense,SB-Z,1,22,"Heidenreich, Eli SR"
Navy Midshipmen,Offense,RB,1,46,"Tecza, Alex SR"
Navy Midshipmen,Defense,DE,1,90,"Moutome, Julien SO"
